{"InstallOptions":{"$type":"Manual","OptionalFeatures":{"WindowsVersion":"10.0.22000.1","Features":["Microsoft-Windows-Subsystem-Linux","VirtualMachinePlatform"]}},"JoinDomain":null,"ComputerName":null,"EnableDefender":true,"EnableCloud":true,"EnableRemoteDesktop":false,"EnableServerManager":true,"LocalAccounts":[],"AutoLogon":null,"CmdKeyAccount":null,"DisplayResolution":null,"Language":"en-US","ProductKey":null,"ProcessorArchitecture":"amd64","TimeZone":"Pacific Standard Time","FirstLogonCommands":[],"SetupScripts":[]}