{
    "$schema": "https://www.ookii.org/Link/AnswerFileJsonSchema-2.0",
    "InstallOptions": {
        "$type": "CleanEfi",
        "Partitions": [
            {
                "Type": "System",
                "Label": "System",
                "Size": "128 GiB",
                "FileSystem": null
            },
            {
                "Type": "Normal",
                "Label": "Windows",
                "Size": null,
                "FileSystem": null
            }
        ],
        "DiskId": 2,
        "OptionalFeatures": {
            "WindowsVersion": "10.0.22631.1",
            "Features": [
                "Microsoft-Windows-Subsystem-Linux",
                "VirtualMachinePlatform"
            ]
        }
    },
    "Language": "en-US",
    "ProductKey": "ABCDE-12345-ABCDE-12345-ABCDE",
    "ProcessorArchitecture": "amd64",
    "TimeZone": "Pacific Standard Time"
}